{
  "record_id": "CS-RADAR-ENDPOINT-OPERATIONALIZATION-20261016-v1",
  "record_created_at": "2026-10-17T00:02:01Z",
  "historical_baseline": {
    "baseline_id": "FUTURE-CS-BREAKTHROUGH-RADAR-20261016",
    "baseline_date": "2026-10-16",
    "baseline_type": "HISTORICAL_EDITORIAL_EVIDENCE_ONLY",
    "source_file": "reports/FUTURE_CS_BREAKTHROUGH_RADAR_20261016.json",
    "source_sha256": "184eb27b5dcb7cd367ed1b54ebd5847a3d52dc6fa902aa0c58bdf2fb8fb0afbd",
    "endpoint_was_frozen_in_baseline": false,
    "retroactive_forecast_claim_permitted": false
  },
  "prospective_status": "DESIGN_ONLY_NO_FORECAST_OR_OUTCOME_LABELS",
  "created_after_baseline": true,
  "operationalization_freeze_at": null,
  "freeze_rule": "No proposed event is freeze-ready until all required fields are completed and independently reviewed. If frozen on 2026-10-17, the candidate five-year observation end would be 2031-10-17; this is not an active forecast horizon while freeze_at is null.",
  "shared_adjudication_rules": {
    "evidence_levels": [
      "VERIFIED_SOURCE_FACT",
      "PROPOSED_ENDPOINT",
      "CANDIDATE_OUTCOME_EVIDENCE",
      "INDEPENDENTLY_ADJUDICATED_OUTCOME",
      "UNRESOLVED",
      "MISSING_EVIDENCE",
      "NOT_YET_DUE"
    ],
    "separate_axes": ["attention", "direct_resolution", "premise_refutation_or_revision", "substantive_evidence_progress", "computational_impact"],
    "prohibited_proxies": ["publication_count_as_breakthrough", "citation_count_as_resolution", "topical_similarity_as_resolution", "search_non-detection_as_negative", "proposal_or_benchmark_score_as_executed_evidence"],
    "review_requirement": "Two independent reviewers for any ground-truth outcome; source/version/date and exact endpoint match must be checked separately. A third reviewer adjudicates disagreement.",
    "historical_snapshot_rule": "The 2026-10-16 radar wording remains qualitative editorial evidence only. These event proposals were created after that cutoff and cannot be backdated into that snapshot."
  },
  "items": [
    {
      "item_id": "JOINT_KV_SPECULATIVE_SERVING",
      "source_title": "Joint KV-cache scheduling and speculative decoding under heterogeneous, changing load",
      "horizon_if_frozen_now": {"start": "2026-10-17", "end": "2031-10-17"},
      "status": "PROPOSED_ENDPOINT",
      "readiness": "NEEDS_ENDPOINT_DESIGN",
      "proposed_event": "A versioned joint cache/scheduling/speculation policy is independently reproduced on a held-out, time-varying workload and improves a preselected end-to-end goodput or tail-latency endpoint over separately tuned component policies while meeting the same memory and output-quality constraints.",
      "success_evidence": ["Public versioned implementation and workload trace", "Matched GPU-memory and arrival conditions", "Predeclared quality and SLO noninferiority margins", "Independent reproduction with raw per-workload measurements"],
      "against_or_refutation": ["Matched evaluation shows no qualifying gain", "Gain disappears under held-out load or equal-memory accounting", "Quality or tail-SLO constraint is violated", "Independent reproduction fails"],
      "missing_definition_fields": ["Exact model/hardware and workload population", "Primary metric and numerical noninferiority/superiority margins", "Holdout split and unit of analysis", "Baseline implementations and tuning budget", "Treatment of failures and repeated runs"],
      "reviewer_decisions_required": ["Are component baselines comparably tuned?", "Does the held-out trace represent the claimed load regime?", "Do quality and memory constraints match?", "Is reproduction independent?"],
      "axis_status": {"attention": "EDITORIAL_ONLY_NOT_OUTCOME", "direct_resolution": "UNRESOLVED", "premise_refutation_or_revision": "PROPOSED_ENDPOINT", "substantive_evidence_progress": "PROPOSED_ENDPOINT", "computational_impact": "NEEDS_SEPARATE_DEPLOYMENT_ENDPOINT"},
      "uncertainty_sources": ["Hardware-specific effects", "Trace representativeness", "Quality metric sensitivity", "Correlated workload runs"]
    },
    {
      "item_id": "REPOSITORY_SCALE_VERIFIED_CODE",
      "source_title": "Repository-scale verified code generation and repair",
      "horizon_if_frozen_now": {"start": "2026-10-17", "end": "2031-10-17"},
      "status": "PROPOSED_ENDPOINT",
      "readiness": "NEEDS_ENDPOINT_DESIGN",
      "proposed_event": "On a preregistered set of held-out repositories, an approach produces more independently accepted issue-resolving patches that satisfy hidden regressions and an audited formal specification than a matched baseline, without increasing correctness-critical failures under a fixed compute budget.",
      "success_evidence": ["Frozen repository/task set and versioned patches", "Independent issue-to-spec correspondence audit", "Hidden test results and proof-checker outputs where applicable", "Matched baseline, budget, and repository-level uncertainty"],
      "against_or_refutation": ["No improvement on held-out repositories", "Formal proof passes but intended behavior or hidden tests fail", "Gain vanishes under equal budget", "Specification audit finds material omissions"],
      "missing_definition_fields": ["Task inclusion and repository holdout rules", "Acceptance/correctness endpoint and minimum effect", "How proof-bearing and test-only tasks are stratified", "Compute/token budget", "Independent unit and reviewer protocol"],
      "reviewer_decisions_required": ["Does the specification capture issue intent?", "Are tasks/repositories truly held out?", "Are proof and test outcomes comparable?", "Are patches independently judged without model self-evaluation?"],
      "axis_status": {"attention": "EDITORIAL_ONLY_NOT_OUTCOME", "direct_resolution": "UNRESOLVED", "premise_refutation_or_revision": "PROPOSED_ENDPOINT", "substantive_evidence_progress": "PROPOSED_ENDPOINT", "computational_impact": "NEEDS_DEPLOYMENT_OR_ADOPTION_EVIDENCE"},
      "uncertainty_sources": ["Repository and task heterogeneity", "Specification incompleteness", "Hidden-test leakage", "Patch-level clustering"]
    },
    {
      "item_id": "MULTIAGENT_PROCESS_VERIFICATION",
      "source_title": "Artifact-level process verification for multi-agent execution",
      "horizon_if_frozen_now": {"start": "2026-10-17", "end": "2031-10-17"},
      "status": "PROPOSED_ENDPOINT",
      "readiness": "NEEDS_ENDPOINT_DESIGN",
      "proposed_event": "A prespecified process-verification signal or intervention improves independently adjudicated artifact correctness over no-verifier and deterministic-check baselines on held-out task families at matched runtime/context cost, with false-accept and false-reject rates reported.",
      "success_evidence": ["Frozen task-family holdout", "Independent artifact oracle", "Predeclared costs and error rates", "Replicated comparison against both baselines"],
      "against_or_refutation": ["No improvement after cost matching", "Verifier accepts invalid artifacts above the prespecified bound", "Benefit is confined to seen task families", "Independent adjudicators disagree beyond the frozen tolerance"],
      "missing_definition_fields": ["Verifier class/intervention", "Task population and sample unit", "Correctness threshold and practical margin", "Error-cost weighting", "Run-level clustering and compute cap"],
      "reviewer_decisions_required": ["Is artifact correctness externally checkable?", "Were verifier signals frozen before outcome review?", "Are evaluator and system independent?", "Are false-positive costs included?"],
      "axis_status": {"attention": "EDITORIAL_ONLY_NOT_OUTCOME", "direct_resolution": "UNRESOLVED", "premise_refutation_or_revision": "PROPOSED_ENDPOINT", "substantive_evidence_progress": "PROPOSED_ENDPOINT", "computational_impact": "NOT_DEFINED"},
      "uncertainty_sources": ["Task-mix sensitivity", "Verifier/evaluator dependence", "Human label disagreement", "Context and inference cost"]
    },
    {
      "item_id": "ADAPTIVE_DP_FILTERS",
      "source_title": "Tight, certified filters for fully adaptive differential privacy",
      "horizon_if_frozen_now": {"start": "2026-10-17", "end": "2031-10-17"},
      "status": "PROPOSED_ENDPOINT",
      "readiness": "NEEDS_PARAMETER_REGIME_AND_CERTIFICATE_SPECIFICATION",
      "proposed_event": "A new filter is proved sound for an explicitly enumerated adaptive mechanism family and parameter regime, strictly improves a frozen privacy-utility or bound-tightness criterion over the strongest applicable certified baseline, and has an independently checked numerical implementation certificate.",
      "success_evidence": ["Peer-checkable theorem with complete assumptions", "Explicit covered and excluded parameter ranges", "Matched certified baseline", "Independent proof and interval/error-bound audit"],
      "against_or_refutation": ["Counterexample violates soundness", "No strict improvement over the matched baseline", "Certificate is invalid or omits numerical error", "Claim relies on adaptivity outside the theorem assumptions"],
      "missing_definition_fields": ["Exact mechanism family and parameter region", "Definition of tightness/utility and strict margin", "Baseline version and assumptions", "Certificate checker and precision/error policy", "Proof-review independence"],
      "reviewer_decisions_required": ["Do all adaptive choices satisfy the theorem hypotheses?", "Is comparison against the strongest applicable bound?", "Is numerical soundness independently certified?", "Does theorem scope match the claimed deployment?"],
      "axis_status": {"attention": "EDITORIAL_ONLY_NOT_OUTCOME", "direct_resolution": "UNRESOLVED", "premise_refutation_or_revision": "PROPOSED_ENDPOINT", "substantive_evidence_progress": "PROPOSED_ENDPOINT", "computational_impact": "NEEDS_IMPLEMENTATION_USE_CASE"},
      "uncertainty_sources": ["Proof-assumption mismatch", "Numerical certification", "Parameter-regime fragmentation", "Baseline updates"]
    },
    {